<?xml version="1.0" encoding="utf-8"?><!-- for EXL machine --><?xml-stylesheet type="text/xsl" href="ACQ.xsl"?><!--  EXL ACQ configuration file
-->
<ACQ xmlns:xsi="http://www.w3.org/2001/XMLSchema-instance" xsi:noNamespaceSchemaLocation="ACQ.xsd">
<Header>
<version>1.0</version>
<operator>songx</operator>
<shotnum>04896</shotnum>
</Header>
<Channel>
<ChnlName>AXUV</ChnlName>
<Unit>V</Unit>
<ChnlId>1</ChnlId>
<Len>500000</Len>
<Post>500000</Post>
<MaxDat>32768</MaxDat>
<Freq>50000</Freq>
<LowRang>0</LowRang>
<HighRang>10</HighRang>
<Factor>1</Factor>
<Offset>0</Offset>
<Dly>0</Dly>
<DatAttr>1</DatAttr>
<DatWth>2</DatWth>
<division>control group</division>
<personInCharge>yang</personInCharge>
<fromPosition>Mr Guo dong</fromPosition>
<insituPosition>0</insituPosition>
<implementationHistory>2019</implementationHistory>
<channelDescription>ACQ1</channelDescription>
</Channel>
<Channel>
<ChnlName>SXR</ChnlName>
<Unit>V</Unit>
<ChnlId>2</ChnlId>
<Len>750000</Len>
<Post>500000</Post>
<MaxDat>32768</MaxDat>
<Freq>50000</Freq>
<LowRang>0</LowRang>
<HighRang>10</HighRang>
<Factor>1</Factor>
<Offset>0</Offset>
<Dly>0</Dly>
<DatAttr>1</DatAttr>
<DatWth>2</DatWth>
<division>control group</division>
<personInCharge>yang</personInCharge>
<fromPosition>Mr Guo dong</fromPosition>
<insituPosition>0</insituPosition>
<implementationHistory>2019</implementationHistory>
<channelDescription>ACQ1</channelDescription>
</Channel>
<Channel>
<ChnlName>HXR</ChnlName>
<Unit>V</Unit>
<ChnlId>3</ChnlId>
<Len>750000</Len>
<Post>500000</Post>
<MaxDat>32768</MaxDat>
<Freq>50000</Freq>
<LowRang>0</LowRang>
<HighRang>10</HighRang>
<Factor>1</Factor>
<Offset>0</Offset>
<Dly>0</Dly>
<DatAttr>1</DatAttr>
<DatWth>2</DatWth>
<division>control group</division>
<personInCharge>yang</personInCharge>
<fromPosition>Mr Guo dong</fromPosition>
<insituPosition>0</insituPosition>
<implementationHistory>2019</implementationHistory>
<channelDescription>ACQ1</channelDescription>
</Channel>
<Channel>
<ChnlName>VF</ChnlName>
<Unit>V</Unit>
<ChnlId>4</ChnlId>
<Len>1000000</Len>
<Post>1000000</Post>
<MaxDat>32768</MaxDat>
<Freq>200000</Freq>
<LowRang>0</LowRang>
<HighRang>10</HighRang>
<Factor>1</Factor>
<Offset>0</Offset>
<Dly>0</Dly>
<DatAttr>1</DatAttr>
<DatWth>2</DatWth>
<division>control group</division>
<personInCharge>yang</personInCharge>
<fromPosition>Mr Guo dong</fromPosition>
<insituPosition>0</insituPosition>
<implementationHistory>2019</implementationHistory>
<channelDescription>ACQ1</channelDescription>
</Channel>
<Channel>
<ChnlName>EP</ChnlName>
<Unit>V</Unit>
<ChnlId>5</ChnlId>
<Len>2500000</Len>
<Post>2500000</Post>
<MaxDat>32768</MaxDat>
<Freq>500000</Freq>
<LowRang>0</LowRang>
<HighRang>10</HighRang>
<Factor>1</Factor>
<Offset>0</Offset>
<Dly>0</Dly>
<DatAttr>1</DatAttr>
<DatWth>2</DatWth>
<division>control group</division>
<personInCharge>yang</personInCharge>
<fromPosition>Mr Guo dong</fromPosition>
<insituPosition>0</insituPosition>
<implementationHistory>2019</implementationHistory>
<channelDescription>ACQ1</channelDescription>
</Channel>
<Channel>
<ChnlName>MIR</ChnlName>
<Unit>V</Unit>
<ChnlId>6</ChnlId>
<Len>2500000</Len>
<Post>2500000</Post>
<MaxDat>32768</MaxDat>
<Freq>500000</Freq>
<LowRang>0</LowRang>
<HighRang>10</HighRang>
<Factor>1</Factor>
<Offset>0</Offset>
<Dly>0</Dly>
<DatAttr>1</DatAttr>
<DatWth>2</DatWth>
<division>control group</division>
<personInCharge>yang</personInCharge>
<fromPosition>Mr Guo dong</fromPosition>
<insituPosition>0</insituPosition>
<implementationHistory>2019</implementationHistory>
<channelDescription>ACQ1</channelDescription>
</Channel>
<Channel>
<ChnlName>G1_ECRH</ChnlName>
<Unit>V</Unit>
<ChnlId>7</ChnlId>
<Len>1500000</Len>
<Post>1000000</Post>
<MaxDat>32768</MaxDat>
<Freq>100000</Freq>
<LowRang>0</LowRang>
<HighRang>10</HighRang>
<Factor>1</Factor>
<Offset>0</Offset>
<Dly>0</Dly>
<DatAttr>1</DatAttr>
<DatWth>2</DatWth>
<division>control group</division>
<personInCharge>yang</personInCharge>
<fromPosition>Mr Guo dong</fromPosition>
<insituPosition>0</insituPosition>
<implementationHistory>2019</implementationHistory>
<channelDescription>ACQ2</channelDescription>
</Channel>
<Channel>
<ChnlName>G1_RF</ChnlName>
<Unit>V</Unit>
<ChnlId>8</ChnlId>
<Len>1500000</Len>
<Post>1000000</Post>
<MaxDat>32768</MaxDat>
<Freq>100000</Freq>
<LowRang>0</LowRang>
<HighRang>10</HighRang>
<Factor>1</Factor>
<Offset>0</Offset>
<Dly>0</Dly>
<DatAttr>1</DatAttr>
<DatWth>2</DatWth>
<division>control group</division>
<personInCharge>yang</personInCharge>
<fromPosition>Mr Guo dong</fromPosition>
<insituPosition>0</insituPosition>
<implementationHistory>2019</implementationHistory>
<channelDescription>ACQ2</channelDescription>
</Channel>
<Channel>
<ChnlName>HA</ChnlName>
<Unit>V</Unit>
<ChnlId>9</ChnlId>
<Len>3000000</Len>
<Post>2000000</Post>
<MaxDat>32768</MaxDat>
<Freq>200000</Freq>
<LowRang>0</LowRang>
<HighRang>10</HighRang>
<Factor>1</Factor>
<Offset>0</Offset>
<Dly>0</Dly>
<DatAttr>1</DatAttr>
<DatWth>2</DatWth>
<division>control group</division>
<personInCharge>yang</personInCharge>
<fromPosition>Mr Guo dong</fromPosition>
<insituPosition>0</insituPosition>
<implementationHistory>2019</implementationHistory>
<channelDescription>ACQ1</channelDescription>
</Channel>
<Channel>
<ChnlName>G1_VEC</ChnlName>
<Unit>V</Unit>
<ChnlId>10</ChnlId>
<Len>12000</Len>
<Post>12000</Post>
<MaxDat>32768</MaxDat>
<Freq>100</Freq>
<LowRang>0</LowRang>
<HighRang>10</HighRang>
<Factor>1</Factor>
<Offset>0</Offset>
<Dly>0</Dly>
<DatAttr>1</DatAttr>
<DatWth>2</DatWth>
<division>control group</division>
<personInCharge>yang</personInCharge>
<fromPosition>Mr Guo dong</fromPosition>
<insituPosition>0</insituPosition>
<implementationHistory>2019</implementationHistory>
<channelDescription>ACQ2</channelDescription>
</Channel>
<Channel>
<ChnlName>G1_ECRH_F</ChnlName>
<Unit>V</Unit>
<ChnlId>11</ChnlId>
<Len>6000000</Len>
<Post>5000000</Post>
<MaxDat>32768</MaxDat>
<Freq>1000000</Freq>
<LowRang>0</LowRang>
<HighRang>10</HighRang>
<Factor>1</Factor>
<Offset>0</Offset>
<Dly>0</Dly>
<DatAttr>1</DatAttr>
<DatWth>2</DatWth>
<division>control group</division>
<personInCharge>yang</personInCharge>
<fromPosition>Mr Guo dong</fromPosition>
<insituPosition>0</insituPosition>
<implementationHistory>2019</implementationHistory>
<channelDescription>ACQ2</channelDescription>
</Channel>
<Channel>
<ChnlName>M1_ECRH</ChnlName>
<Unit>V</Unit>
<ChnlId>12</ChnlId>
<Len>1500000</Len>
<Post>1000000</Post>
<MaxDat>32768</MaxDat>
<Freq>100000</Freq>
<LowRang>0</LowRang>
<HighRang>10</HighRang>
<Factor>1</Factor>
<Offset>0</Offset>
<Dly>0</Dly>
<DatAttr>1</DatAttr>
<DatWth>2</DatWth>
<division>control group</division>
<personInCharge>yang</personInCharge>
<fromPosition>Mr Guo dong</fromPosition>
<insituPosition>0</insituPosition>
<implementationHistory>2019</implementationHistory>
<channelDescription>ACQ2</channelDescription>
</Channel>
<Channel>
<ChnlName>GAS</ChnlName>
<Unit>V</Unit>
<ChnlId>13</ChnlId>
<Len>1500000</Len>
<Post>1000000</Post>
<MaxDat>32768</MaxDat>
<Freq>100000</Freq>
<LowRang>0</LowRang>
<HighRang>10</HighRang>
<Factor>1</Factor>
<Offset>0</Offset>
<Dly>0</Dly>
<DatAttr>1</DatAttr>
<DatWth>2</DatWth>
<division>control group</division>
<personInCharge>yang</personInCharge>
<fromPosition>Mr Guo dong</fromPosition>
<insituPosition>0</insituPosition>
<implementationHistory>2019</implementationHistory>
<channelDescription>ACQ2</channelDescription>
</Channel>
<Channel>
<ChnlName>G1_TEC</ChnlName>
<Unit>V</Unit>
<ChnlId>14</ChnlId>
<Len>12000</Len>
<Post>12000</Post>
<MaxDat>32768</MaxDat>
<Freq>100</Freq>
<LowRang>0</LowRang>
<HighRang>10</HighRang>
<Factor>1</Factor>
<Offset>0</Offset>
<Dly>0</Dly>
<DatAttr>1</DatAttr>
<DatWth>2</DatWth>
<division>control group</division>
<personInCharge>yang</personInCharge>
<fromPosition>Mr Guo dong</fromPosition>
<insituPosition>0</insituPosition>
<implementationHistory>2019</implementationHistory>
<channelDescription>ACQ2</channelDescription>
</Channel>
<Channel>
<ChnlName>MWI</ChnlName>
<Unit>V</Unit>
<ChnlId>15</ChnlId>
<Len>1000000</Len>
<Post>600000</Post>
<MaxDat>32768</MaxDat>
<Freq>100000</Freq>
<LowRang>0</LowRang>
<HighRang>10</HighRang>
<Factor>1</Factor>
<Offset>0</Offset>
<Dly>0</Dly>
<DatAttr>1</DatAttr>
<DatWth>2</DatWth>
<division>control group</division>
<personInCharge>yang</personInCharge>
<fromPosition>Mr Guo dong</fromPosition>
<insituPosition>0</insituPosition>
<implementationHistory>2019</implementationHistory>
<channelDescription>ACQ4</channelDescription>
</Channel>
<Channel>
<ChnlName>MPT</ChnlName>
<Unit>V</Unit>
<ChnlId>16</ChnlId>
<Len>2500000</Len>
<Post>1500000</Post>
<MaxDat>32768</MaxDat>
<Freq>100000</Freq>
<LowRang>0</LowRang>
<HighRang>10</HighRang>
<Factor>1</Factor>
<Offset>0</Offset>
<Dly>0</Dly>
<DatAttr>1</DatAttr>
<DatWth>2</DatWth>
<division>control group</division>
<personInCharge>yang</personInCharge>
<fromPosition>Mr Guo dong</fromPosition>
<insituPosition>0</insituPosition>
<implementationHistory>2019</implementationHistory>
<channelDescription>ACQ3</channelDescription>
</Channel>
<Channel>
<ChnlName>MPN</ChnlName>
<Unit>V</Unit>
<ChnlId>17</ChnlId>
<Len>2500000</Len>
<Post>1500000</Post>
<MaxDat>32768</MaxDat>
<Freq>100000</Freq>
<LowRang>0</LowRang>
<HighRang>10</HighRang>
<Factor>1</Factor>
<Offset>0</Offset>
<Dly>0</Dly>
<DatAttr>1</DatAttr>
<DatWth>2</DatWth>
<division>control group</division>
<personInCharge>yang</personInCharge>
<fromPosition>Mr Guo dong</fromPosition>
<insituPosition>0</insituPosition>
<implementationHistory>2019</implementationHistory>
<channelDescription>ACQ3</channelDescription>
</Channel>
<Channel>
<ChnlName>FLUX</ChnlName>
<Unit>V</Unit>
<ChnlId>18</ChnlId>
<Len>2500000</Len>
<Post>1500000</Post>
<MaxDat>32768</MaxDat>
<Freq>100000</Freq>
<LowRang>0</LowRang>
<HighRang>10</HighRang>
<Factor>1</Factor>
<Offset>0</Offset>
<Dly>0</Dly>
<DatAttr>1</DatAttr>
<DatWth>2</DatWth>
<division>control group</division>
<personInCharge>yang</personInCharge>